{
  "processed_experience": {
    "lead_data_engineer": "5 years",
    "data_scientist": "1 year",
    "junior_computer_science_engineer": "1 year"
  },
  "processed_education": [
    "Bachelor of Computer Engineering",
    "Master of Intelligent Interactive System"
  ],
  "final name": "Francisco",
  "concatenated_summary": "Name: Francisco | Experience: lead_data_engineer: 5 years, data_scientist: 1 year, junior_computer_science_engineer: 1 year | Languages: Spanish Native, Catalan Native, English C1 | Education: Bachelor of Computer Engineering, Master of Intelligent Interactive System | Technical Skills: Amazon S3, Active Learning, Amazon ECS, Apache Cassandra, Apache Flink, Apache Hive, Apache Kafka, Apache Spark, AWS, AWS CloudFormation, AWS Glue, AWS Lambda, AWS RDS, AWS Redshift, AWS S3, AWS SQS, Azure, Azure Data Factory, Azure DevOps, Azure Kubernetes Service, Azure Synapse, Computer Vision, Data Versioning, Data Warehouse, Data Lake, Data Mesh, Delta Lake, Deep Learning, Docker, Elastic Load Balancing, Elastic Beanstalk, Fine-tuning, Grafana, HBase, Iceberg, Impala, Jupyter Notebooks, Kafka, Kubernetes, Kylin, MapReduce, Model Compression, Model Explainability, Model Optimization, MongoDB, Neural Networks, Pulumi, Redshift, Self-Supervised Learning, Snowflake, Spark, Terraform, Video Analysis, Airflow, dbt | Programming Languages: C++, C, Go, Java, Julia, Kotlin, Python, R, Scala | Programming Language Packages: OpenMP (C++), TBB (C++), CUDA (C++), OpenCV (C++), OpenGL (C++), Pthreads (C), CUDA (C), OpenMP (C), TensorFlow (C), Torch (C), Kafka-Go (Go), Golang ETL (Go), Grpc (Go), Go-micro (Go), cupy (Go), numba (Go), ray (Go), Apache Spark (Java API) (Java), Apache Flink (Java), Kafka (Java), Deeplearning4j (Java), Akka (Java), Spring (Java), Apache Kafka (Java), Gson (Java), Jackson (Java), JUnit (Java), Log4j (Java), Maven (Java), Plots.jl (Julia), StatsPlots.jl (Julia), MLJ.jl (Julia), CSV.jl (Julia), DataFrames.jl (Julia), Distributed (Julia), Distributed.jl (Julia), Dagger.jl (Julia), kmath (Kotlin), Coroutines (Kotlin), Akka (Kotlin), Pandas (Python), BeautifulSoup (Python), Cython (Python), Dash (Python), Django (Python), FastAPI (Python), Flask (Python), Jupyter (Python), Keras (Python), Matplotlib (Python), NumPy (Python), OpenCV (Python), Plotly (Python), Bokeh (Python), PySpark (Python), Pytest-django (Python), Pytest-flask (Python), PyTorch (Python), Requests (Python), Scikit-image (Python), Scikit-learn (Python), SymPy (Python), TensorFlow (Python), Tkinter (Python), caret (R), mlr3 (R), ggplot2 (R), keras (R), tensorflow (R), doParallel (R), sparklyr (R), future (R), igraph (R), Akka (Scala), Cats (Scala), ScalaTest (Scala), Spark MLlib (Scala), Spark (Scala), Akka Streams (Scala), Kafak (Scala)"
}